<?xml version="1.0" encoding="utf-8"?>
<?xml-stylesheet type="text/xsl" href="Analisis_de_pacientes.xslt"?>
<Resultados_de_los_pacientes xmlns:xsi="http://www.w3.org/2001/XMLSchema-instance" xsi:noNamespaceSchemaLocation="Analisis_de_pacientes.xsd">
    <Paciente id="1">
        <Identificacion>
            <Nombre>Juan</Nombre>
            <Apellido1>Castillo</Apellido1>
            <Apellido2>Villa</Apellido2>
            <Edad>30</Edad>              <!--La edad se considera un factor de riesgo-->
            <Genero>Masculino</Genero> 
            <Bloodtype>AB+</Bloodtype>
        </Identificacion>
        <Centro_sanitario>Hospital Militar Principal de Luanda</Centro_sanitario>
        <Resultados>
            <Diagnostico>Positivo en Malaria</Diagnostico>
            <Especie_plasmodium>P. falciparum</Especie_plasmodium>
            <numero_parasito>50000</numero_parasito>  <!--La enfermedad se considera grave a partir de los 10000 parásitos/µL-->
            <Severidad>Grave</Severidad>
        </Resultados>
        <Procesamiento>
            <Imagen>imagenes/20170831_234431.jpg</Imagen>
            <Muestra>Frotis fino</Muestra>
            <Tinción>Giemsa</Tinción>
            <Fecha_de_diagnostico>2505-05-05</Fecha_de_diagnostico>
            <Modelo>Modelo de Machine Learning v1.0</Modelo>
            <Nivel_de_Confianza>Media</Nivel_de_Confianza>
        </Procesamiento>   
    </Paciente>
</Resultados_de_los_pacientes>